original|improved
A V S AMER INST PHYSICS|A V S AMERICAN INSTITUTE OF PHYSICS
ACAD AMER FRANCISCAN HIST|ACADEMY OF AMERICAN FRANCISCAN HISTORY
ACAD MANAGED CARE PHARMACY|ACADEMY OF MANAGED CARE PHARMACY
ACADEMIC PRESS LTD- ELSEVIER SCIENCE LTD|ACADEMIC PRESS
Academic Press Ltd-Elsevier Science Ltd|ACADEMIC PRESS
ACADEMIC PRESS INC ELSEVIER SCIENCE|ACADEMIC PRESS
ACOUSTICAL SOC AMER AMERICAN INSTITUTE OF PHYSICS|ACOUSTICAL SOCIETY OF AMERICA
ADIS INT LTD|ADIS INTERNATIONAL LIMITED
ADIS INT LTD|ADIS INTERNATIONAL LIMITED
AEROSPACE MEDICAL ASSOC|AEROSPACE MEDICAL ASSOCIATION
AGRICULTURAL INSTITUTE CANADA|AGRICULTURAL INSTITUTE OF CANADA
Akademiai Kiado Rt|AKADEMIAI KIADO RT
AM SOC INTERVENTIONAL PAIN PHYSICIANS|AMERICAN SOCIETY OF INTERVENTIONAL PAIN PHYSICIANS
AMER  ASSOC TEACHERS SPANISH PORTUGUESE, INC|AMERICAN ASSOCIATION OF TEACHERS OF SPANISH AND PORTUGUESE, INC
AMER ACAD AUDIOLOGY|AMERICAN ACADEMY OF AUDIOLOGY
AMER ACAD FAMILY PHYSICIANS|AMERICAN ACADEMY OF FAMILY PHYSICIANS
AMER ACAD PEDIATRICS|AMERICAN ACADEMY OF PEDIATRICS
AMER ACAD PSYCHIATRY and LAW|AMERICAN ACADEMY OF PSYCHIATRY AND LAW
AMER ACAD SLEEP MEDICINE|AMERICAN ACADEMY OF SLEEP MEDICINE  
AMER ASSOC ADVANCEMENT SCIENCE|AMERICAN ASSOCIATION FOR THE ADVANCEMENT OF SCIENCE
AMER ASSOC ADVANCEMENT SCIENCE|AMERICAN ASSOCIATION FOR THE ADVANCEMENT OF SCIENCE
AMERICAN ASSOCIATION ADVANCEMENT SCIENCE|AMERICAN ASSOCIATION FOR THE ADVANCEMENT OF SCIENCE
AMER ASSOC CANCER RESEARCH|AMERICAN ASSOCIATION FOR CANCER RESEARCH
AMERICAN ASSOCIATION CANCER RESEARCH|AMERICAN ASSOCIATION FOR CANCER RESEARCH
AMER ASSOC CLINICAL CHEMISTRY|AMERICAN ASSOCIATION FOR CLINICAL CHEMISTRY
AMER ASSOC CLINICAL ENDOCRINOLOGISTS|AMERICAN ASSOCIATION OF CLINICAL ENDOCRINOLOGISTS
AMER ASSOC COLL PHARMACY|AMERICAN ASSOCIATION OF COLLEGES OF PHARMACY
AMER ASSOC COLL PHARMACY|AMERICAN ASSOCIATION OF COLLEGES OF PHARMACY
AMER ASSOC IMMUNOLOGISTS|AMERICAN ASSOCIATION OF IMMUNOLOGISTS
AMER ASSOC LABORATORY ANIMAL SCIENCE|AMERICAN ASSOCIATION OF LABORATORY ANIMAL SCIENCE
AMER ASSOC LAW LIBRARIES|AMERICAN ASSOCIATION OF LAW LIBRARIES
AMER ASSOC NEUROLOGICAL SURGEONS|AMERICAN ASSOCIATION OF NEUROLOGICAL SURGEONS
AMERICAN ASSOCIATION NEUROLOGICAL SURGEONS|AMERICAN ASSOCIATION OF NEUROLOGICAL SURGEONS
AMER ASSOC PHYSICISTS MEDICINE AMER INST PHYSICS|AMERICAN ASSOCIATION OF PHYSICISTS IN MEDICINE
American Association of Physicists in Me|AMERICAN ASSOCIATION OF PHYSICISTS IN MEDICINE
AMER ASSOC TEACHERS FRENCH|AMERICAN ASSOCIATION OF TEACHERS OF FRENCH
AMER ASSOC TEACHERS SLAVIC EAST EUROPEAN LANGUAGES|AMERICAN ASSOCIATION OF TEACHERS OF SLAVIC AND EAST EUROPEAN LANGUAGES
AMER ASSOC TEACHERS SPANISH PORTUGUESE, INC|AMERICAN ASSOCIATION OF TEACHERS OF SPANISH AND PORTUGUESE
AMER ASSOC TEXTILE CHEMISTS COLORISTS|AMERICAN ASSOCIATION OF TEXTILE CHEMISTS AND COLORISTS
AMER ASSOC ZOO VETERINARIANS|AMERICAN ASSOCIATION OF ZOO VETERINARIANS
AMER BAR ASSOC, ADMINISTRATIVE LAW \& REGULATORY PRACTICE SECTION|AMERICAN BAR ASSOCIATION
AMER BOARD FAMILY MEDICINE|AMERICAN BOARD OF FAMILY MEDICINE
AMER CHEMICAL SOC|AMERICAN CHEMICAL SOCIETY
AMER COLL CHEST PHYSICIANS|AMERICAN COLLEGE OF CHEST PHYSICIANS
AMER COLL PHYSICIANS|AMERICAN COLLEGE OF PHYSICIANS
AMER COLL VET PATHOLOGIST|AMERICAN COLLEGE OF VETERINARY PATHOLOGISTS
AMER CONCRETE INST|AMERICAN CONCRETE INSTITUTE
AMER FOLKLORE SOC|AMERICAN FOLKLORE SOCIETY
AMER INST AERONAUT ASTRONAUT|AMERICAN INSTITUTE OF AERONAUTICS AND ASTRONAUTICS
AMER INST AERONAUTICS  ASTRONAUTICS|THE AMERICAN INSTITUTE OF AERONAUTICS AND ASTRONAUTICS
AMERICAN INSTITUTE AERONAUTICS ASTRONAUTICS|THE AMERICAN INSTITUTE OF AERONAUTICS AND ASTRONAUTICS
AMER INST BIOLOGICAL SCI|AMERICAN INSTITUTE OF BIOLOGICAL SCIENCE
AMER INST MATHEMATICAL SCI|AMERICAN INSTITUTE OF MATHEMATICAL SCIENCES
AMER INST MATHEMATICAL SCIENCES|AMERICAN INSTITUTE OF MATHEMATICAL SCIENCES
AMER INST PHYSICS|AMERICAN INSTITUTE OF PHYSICS
AMERICAN INSTITUTE PHYSICS|AMERICAN INSTITUTE OF PHYSICS
AMER JOURNAL HEALTH PROMOTION INC|AMERICAN JOURNAL OF HEALTH PROMOTION INC
AMER MEDICAL ASSOC|AMERICAN MEDICAL ASSOCIATION
AMER MUSEUM NATURAL HISTORY|AMERICAN MUSEUM OF NATURAL HISTORY
AMER OCCUPATIONAL THERAPY ASSOC, INC|AMERICAN OCCUPATIONAL THERAPY ASSOCIATION
AMER PHYSICAL THERAPY ASSOC|AMERICAN PHYSICAL THERAPY ASSOCIATION
AMER PHYSIOLOGICAL SOC|AMERICAN PHYSIOLOGICAL SOCIETY
AMER PSYCHOLOGICAL ASSOC|AMERICAN PHYSIOLOGICAL ASSOCIATION
AMER PSYCHIATRIC PUBLISHING, INC|AMERICAN PSYCHIATRIC PUBLISHING
AMER PSYCHIATRIC PUBLISHING, INC|AMERICAN PSYCHIATRIC PUBLISHING, INC
AMER PUBLIC HEALTH ASSOC INC|AMERICAN PUBLIC HEALTH ASSOCIATION
AMER PUBLIC HEALTH ASSOCIATION INC|AMERICAN PUBLIC HEALTH ASSOCIATION
AMER SOC AGRICULTURAL \& BIOLOGICAL ENGINEERS|AMERICAN SOCIETY OF AGRICULTURAL AND BIOLOGICAL ENGINEERS
AMER SOC AGRONOMY|AMERICAN SOCIETY OF AGRONOMY
AMERICAN SOCIETY AGRONOMY|AMERICAN SOCIETY OF AGRONOMY
AMER SOC ANIMAL SCIENCE|AMERICAN SOCIETY OF ANIMAL SCIENCE
AMER SOC BIOCHEMISTRY MOLECULAR BIOLOGY INC|AMERICAN SOCIETY OF BIOCHEMISTRY AND MOLECULAR BIOLOGY
AMER SOC CLINICAL INVESTIGATION INC|AMERICAN SOCIETY FOR CLINICAL INVESTIGATION    
AMER SOC CLINICAL ONCOLOGY|AMERICAN SOCIETY OF CLINICAL ONCOLOGY
AMER SOC CLINICAL PATHOLOGY|AMERICAN SOCIETY FOR CLINICAL PATHOLOGY
AMERICAN SOCIETY CLINICAL PATHOLOGY|AMERICAN SOCIETY FOR CLINICAL PATHOLOGY
AMER SOC ENGINEERING EDUCATION|AMERICAN SOCIETY FOR ENGINEERING EDUCATION
AMERICAN ACADEMY FAMILY PHYSICIANS|AMERICAN ACADEMY OF FAMILY PHYSICIANS
AMER SOC HEALTH-SYSTEM PHARMACISTS|AMERICAN SOCIETY OF HEALTH SYSTEM PHARMACISTS
AMER SOC HEMATOLOGY|AMERICAN SOCIETY OF HEMATOLOGY
AMER SOC HORTICULTURAL SCIENCE|AMERICAN SOCIETY FOR HORTICULTURAL SCIENCE
AMERICAN SOCIETY HORTICULTURAL SCIENCE|AMERICAN SOCIETY FOR HORTICULTURAL SCIENCE
AMER SOC ICHTHYOLOGISTS \& HERPETOLOGISTS|AMERICAN SOCIETY OF ICHTHYOLOGISTS AND HERPETOLOGISTS
AMER SOC ICHTHYOLOGISTS HERPETOLOGISTS|AMERICAN SOCIETY OF ICHTHYOLOGISTS AND HERPETOLOGISTS
AMER SOC LIMNOLOGY OCEANOGRAPHY|ASSOCIATION FOR THE SCIENCES OF LIMNOLOGY AND OCEANOGRAPHY
AMER SOC MICROBIOLOGY|AMERICAN SOCIETY FOR MICROBIOLOGY
AMERICAN SOCIETY MICROBIOLOGY|AMERICAN SOCIETY FOR MICROBIOLOGY
AMER SOC NEPHROLOGY|AMERICAN SOCIETY OF NEPHROLOGY
AMER SOC NEURORADIOLOGY|AMERICAN SOCIETY OF NEURORADIOLOGY
AMER SOC NUTRITIONAL SCIENCE|AMERICAN SOCIETY FOR NUTRITIONAL SCIENCE
AMER SOC NUTRITION-ASN|AMERICAN SOCIETY FOR NUTRITION
AMER SOC PARASITOLOGISTS|AMERICAN SOCIETY PARASITOLOGYSTS
AMER SOC PHARMACOLOGY EXPERIMENTAL THERAPEUTICS|AMERICAN SOCIETY FOR PHARMACOLOGY AND EXPERIMENTAL THERAPEUTICS
AMER SOC PHOTOGRAMMETRY|AMERICAN SOCIETY FOR PHOTOGRAMMETRY AND REMOTE SENSING
AMER SOC PLANT BIOLOGISTS|AMERICAN SOCIETY OF PLANT BIOLOGISTS
AMER SOC PLANT TAXONOMISTS|AMERICAN SOCIETY OF PLANT TAXONOMISTS
AMER SOC TESTING MATERIALS|ASTM INTERNATIONAL
AMER SOC TROP MED \& HYGIENE|AMERICAN SOCIETY OF TROPICAL MEDICINE AND HYGIENE
AMERICAN ALLIANCE HEALTH PHYS EDUC REC AND DANCE|AMERICAN ALLIANCE FOR HEALTH, PHYSICAL EDUCATION, RECREATION AND DANCE
AMERICAN BOARD FAMILY MEDICINE|AMERICAN BOARD OF FAMILY MEDICINE
American Diabetes Association|AMERICAN DIABETES ASSOCIATION
AMERICAN INSTITUTE OF BIOLOGICAL SCIENCE|AMERICAN INSTITUTE OF BIOLOGICAL SCIENCES
ANNALS FAMILY MEDICINE|ANNALS OF FAMILY MEDICINE
Arkat Usa Inc|ARKAT USA, INC
ARCHAEOLOGIES-JOURNAL OF THE WORLD ARCHAEOLOGICAL CONGRESS|ARCHAEOLOGIES- THE JOURNAL OF THE WORLD ARCHAEOLOGICAL CONGRESS
ASCE-AMER SOC CIVIL ENGINEERS|AMERICAN SOCIETY OF CIVIL ENGINEERS
ASCE-AMERICAN SOCIETY CIVIL ENGINEERS|AMERICAN SOCIETY OF CIVIL ENGINEERS
ASME|AMERICAN SOCIETY OF MECHANICAL ENGINEERS
ASME-AMERICAN SOCIETY MECHANICAL ENGINEERS|AMERICAN SOCIETY OF MECHANICAL ENGINEERS
ASSOC BRASILEIRA HORTICULTURA|HORTICULTURAL ASSOCIATION OF BRAZIL   
ASSOC COMPUTING MACHINERY|ASSOCIATION FOR COMPUTING MACHINERY
ASSOC EDUC JOURNALISM MASS COMMUNICATION|ASSOCIATION FOR EDUCATION IN JOURNALISM AND MASS COMMUNICATIONS    
ASSOC EDUCATION JOURNALISM MASS COMMUNICATION|ASSOCIATION FOR EDUCATION IN JOURNALISM AND MASS COMMUNICATIONS
ASSOC FIRE ECOLOGY|ASSOCIATION FOR FIRE ECOLOGY
ASSOC NAC HISTORIA-ANPUH|ASSOCIATION NATIONAL DE HISTORIA-ANPUH
ASSOC RESEARCH VISION OPHTHALMOLOGY INC|ASSOCIATION FOR RESEARCH IN VISION AND OPHTHALMOLOGY
ASSOC SCHOOLS PUBLIC HEALTH|ASSOCIATION OF SCHOOLS OF PUBLIC HEALTH
ASSOCIATION COMPUTING MACHINERY|ASSOCIATION OF COMPUTING MACHINERY
ASSOCIATION MILITARY SURGEONS US|ASSOCIATION OF MILITARY SURGEONS OF THE UNITED STATES
AUSTRALIAN PHYSIOTHERAPY ASSOC|AUSTRALIAN PHYSIOTHERAPY ASSOCIATION
BAISHIDENG PUBL GRP CO LTD|BAISHIDENG PUBLISHING GROUP COMPANY LIMITED
BOTANICAL SOC AMER INC|BOTANICAL SOCIETY OF AMERICA
BOTANICAL SOCIETY AMERICAN INC|BOTANICAL SOCIETY OF AMERICA
BOTANICAL SOCIETY OF AMERICA|BOTANICAL SOCIETY OF AMERICA
BRITISH CATTLE VETERINARY ASSOC|BRITISH CATTLE VETERINARY ASSOCIATION
BRITISH HERPETOL SOC|BRITISH HERPETOLOGICAL SOCIETY
BRITISH INSTITUTE RADIOLOGY|BRITISH INSTITUTE OF RADIOLOGY
CALCULUS OF VARIATIONS AND PARTIAL DIFFE|CALCULUS OF VARIATIONS AND PARTIAL DIFFERENTIAL EQUATIONS
CANADIAN ASSOC OCCUPATIONAL THERAPISTS|CANADIAN ASSOCIATION OF OCCUPATIONAL THERAPISTS
CENTERS DISEASE CONTROL|CENTERS FOR DISEASE CONTROL AND PREVENTION
Centers for Disease Control and Preventi|CENTERS FOR DISEASE CONTROL AND PREVENTION
CENTRAL MICHIGAN UNIVERSITY CLARKE HISTO|CENTRAL MICHIGAN UNIVERSITY CLARKE HISTORICAL LIBRARY
CHIANG MAI UNIV|CHIANG MAI UNIVERSITY
CHINESE INST ENGINEERS|CHINESE INSTITUTE OF ENGINEERS
Chin Society Immunology|CHINESE SOCIETY FOR IMMUNOLOGY
CHURCHILL LIVINGSTONE INC MEDICAL PUBLISHERS|CHURCHILL LIVINGSTONE
CLINICAL and EXPER RHEUMATOLOGY|CLINICAL AND EXPERIMENTAL RHEUMATOLOGY
CMA-CANADIAN MEDICAL ASSOC|CANADIAN MEDICAL ASSOCIATION
COLD SPRING HARBOR LAB PRESS, PUBLICATIONS DEPARTMENT|COLD SPRING HARBOR LABORATORY PRESS
COLL AMER PATHOLOGISTS|COLLEGE OF AMERICAN PATHOLOGISTS
COMMONWEALTH FORESTRY ASSOC|COMMONWEALTH FORESTRY ASSOCIATION
CORWIN PRESS INC A SAGE PUBLICATIONS CO|SAGE PUBLICATIONS COMPANY
COUNCIL CHILDREN BEHAVIORAL DISORDERS|COUNCIL FOR CHILDREN WITH BEHAVIORAL DISORDERS
COUNCIL EXCEPTIONAL CHILDREN|COUNCIL FOR EXCEPTIONAL CHILDREN
COUNCIL LEARNING DISABILITIES|COUNCIL FOR LEARNING DISABILITIES
CROP SCIENCE SOC AMER|CROP SCIENCE SOCIETY OF AMERICA
CURRENT HIST INC|CURRENT HISTORY
DENVER UNIV LAW REV|DENVER UNIVERSITY LAW REVIEW
DE GRUYTER OPEN LTD|DE GRUYTER OPEN LIMITED
ECOLOGICAL SOC AMER|ECOLOGICAL SOCIETY OF AMERICA
ECOLOGICAL SOCIETY AMERICAN|ECOLOGICAL SOCIETY OF AMERICA
ELSEVIER SCI LTD|ELSEVIER SCIENCE LTD
ENDOCRINESOC|THE ENDOCRINE SOCIETY
ENTOMOLOGICAL SOCIETY TURKEY, EGE UNIVER|ENTOMOLOGICAL SOCIETY TURKEY, EGE UNIVERSITY
ENTOMOLOGICAL SOC AMER|ENTOMOLOGICAL SOCIETY OF AMERICA
ENTOMOLOGICAL SOC BRASIL|ENTOMOLOGICAL SOCIETY OF BRASIL
ENTOMOL SOC WASHINGTON|ENTOMOLOGICAL SOCIETY OF WASHINGTON
EUR CENTRE DIS PREVENTION \& CONTROL|EUROPEAN CENTRE FOR DISEASE PREVENTION AND CONTROL
EUROPEAN ASSOC AQUATIC MAMMALS|EUROPEAN ASSOCIATION FOR AQUATIC MAMMALS
EUROPEAN MATHEMATICAL SOC|EUROPEAN MATHEMATICAL SOCIETY
EURASIA|EURASIA JOURNAL OF MATHEMATICS SCIENCE AND TECHNOLOGY EDUCATION
EWHA WOMANS UNIV PRESS|EWHA WOMANS UNIVERSITY PRESS
FEDERATION AMER SOC EXP BIOL|FEDERATION OF AMERICAN SOCIETIES FOR EXPERIMENTAL BIOLOGY
FEDERATION AMERICAN SOCIETY EXP BIOL|FEDERATION OF AMERICAN SOCIETIES FOR EXPERIMENTAL BIOLOGY
FEDERATON OF AMERICAN SOCIETIES FOR EXPERIMENTAL BIOLOGY BIOL|FEDERATON OF AMERICAN SOCIETIES FOR EXPERIMENTAL BIOLOGY
FEDERATION AMERICAN SOCIETY EXP|FEDERATON OF AMERICAN SOCIETIES FOR EXPERIMENTAL BIOLOGY
FRESHWATER BIOLOGICAL ASSOC|FRESHWATER BIOLOGICAL ASSOCIATION
GENETICS SOC AM|GENETICS SOCIETY OF AMERICA
GENETICS SOCIETY AMERICA|GENETICS SOCIETY OF AMERICA
GEOLOGICAL SOC AMER, INC|GEOLOGICAL SOCIETY OF AMERICA, INC
GEOLOGICAL SOC PUBL HOUSE|GEOLOGICAL SOCIETY PUBLISHERS HOUSE
GERONTOLOGICAL SOC AMER|GERONTOLOGICAL SOCIETY OF AMERICA
GIGA INST AFRICAN AFFAIRS|GIGA INSTITUTE OF AFRICAN AFFAIRS
HISTORICAL SOC PA|HISTORICAL SOCIETY OF PENNSYLVANIA
HOSOKAWA POWDER TECHNOL FOUNDATION|HOSOKAWA POWDER TECHNOLOGY FOUNDATION
HUMAN KINETICS PUBL INC|HUMAN KINETICS PUBLISHERS INC
HUMAN KINETICS PUBLISHING INC|HUMAN KINETICS PUBLISHERS INC
HUNTER COLLEGE-CUNY, CENTER PUERTO RICAN STUDIES|HUNTER COLLEGE-CUNY, CENTER FOR PUERTO RICAN STUDIES
ICE PUBLISHING|INSTITUTION OF CIVIL ENGINEERS PUBLISHING
IEEE-INST ELECTRICAL ELECTRONICS ENGINEERS INC|INSTITUTE OF ELECTRICAL AND ELECTRONICS ENGINEERS
INDEPENDENT INST|THE INDEPENDENT INSTITUTE
INDIAN ACAD SCIENCES|INDIAN ACADEMY OF SCIENCES
INSTITUTE OF ELECTRICAL AND ELECTRONICS ENGINEERS|INSTITUTE OF ELECTRICAL AND ELECTRONICS ENGINEERS
IGI PUBL|IGI PUBLISHER
INST BIOLOGIA, UNIV NACIONAL AUTONOMA MEXICO|INSTITUTE DE BIOLOGIA, UNIVERSITY NACIONAL AUTONOMA MEXICO
INST CHEMICAL ENGINEERS|INSTITUTE OF CHEMICAL ENGINEERS
INST ENGINEERING TECHNOLOGY-IET|INSTITUTE OF ENGINEERING TECHNOLOGY
INST LOCAL SELF-GOVERNMENT PUBLIC PROCUREMENT MARIBOR|INSTITUTE OF LOCAL SELF-GOVERNMENT PUBLIC PROCUREMENT MARIBOR
INST MATHEMATICAL STATISTICS|INSTITUTE OF MATHEMATICAL STATISTICS
INST TRANSPORTATION ENGINEERS|INSTITUTE OF TRANSPORTATION ENGINEERS
INSTITUTE HISTOL EMBRIOL-CONICET|INSTITUTE OF HISTOLOGY AND EMBRYOLOGY (IHEM-CONICET)
INT ASSOC PLANT TAXONOMY-IAPT|INTERNATIONAL ASSOCIATION FOR PLANT TAXONOMY
INT BEE RESEARCH ASSOC|INTERNATIONAL BEE RESEARCH ASSOCIATION
INT FOOD and AGRIBUSINESS MANAGEMENT REVIEW|INTERNATIONAL FOOD AND AGRIBUSINESS MANAGEMENT REVIEW
INT INFORMATION INST|INTERNATIONAL INFORMATION INSTITUTE
INT MEDICAL PRESS LTD|INTERNATIONAL MEDICAL PRESS LIMITED
INT SCIENTIFIC LITERATURE, INC|INTERNATIONAL SCIENTIFIC LITERATURE, INC
INT SOC BAYESIAN ANALYSIS|INTERNATIONAL SOCIETY FOR BAYESIAN ANALYSIS
INT MARKETING REPORTS LTD|INTERNATIONAL MARKETING REPORTS LTD
IRANIAN SCIENTIFIC SOCIETY MEDICAL ENTOM|IRANIAN SCIENTIFIC SOCIETY MEDICAL ENTOMMOLOGY
IVYSPRING INT PUBL|IVYSPRING INTERNATIONAL PUBLISHER
J O S P T|JOURNAL OF ORTHOPAEDIC & SPORTS PHYSICAL THERAPY
J RHEUMATOL PUBL CO|JOURNAL OF RHEUMATOLOGY PUBLISHING COMPANY
J ROSS PUBL|J ROSS PUBLISHING INC
JAPAN SOC APPLIED PHYSICS|JAPAN SOCIETY OF APPLIED PHYSICS  
JAPAN SOC VET SCI|JAPANESE SOCIETY OF VETERINARY SCIENCE
JMNI|JOURNAL OF MUSCULOSKELETAL AND NEURONAL INTERACTIONS 
JOHN WILEY \& SONS INC|JOHN WILEY AND SONS INC
JOURNAL APPL BEHAV ANAL|JOURNAL OF APPLIED BEHAVIORAL ANALYSIS
JOURNAL FIELD ARCHEOLOGY|JOURNAL OF FIELD ARCHEOLOGY
JOURNAL PEDODONTICS INC|THE JOURNAL OF PEDODONTICS
JOURNAL WUHAN UNIV TECHNOLOGY|JOURNAL OF THE WUHAN UNIVERSITY OF TECHNOLOGY
KARST RESEARCH INST ZRC SAZU|KARST RESEARCH INSTITUTE-ZRC SAZU
KAFKAS UNIV, VETERINER FAKULTESI DERGISI|JOURNAL OF THE FACULTY OF VETERINARY MEDICINE, KAFKAS UNIVERSITY
KOREAN METEOROLOGICAL SOC|KOREAN METEOROLOGICAL SOCIETY
KOREAN NEUROLOGICAL ASSOC|KOREAN NEUROLOGICAL ASSOCIATION
KOREAN SOCIETY MICROBIOLOGY AND BIOTECHN|KOREAN SOCIETY MICROBIOLOGY AND BIOTECHNOLOGY
KOREAN SOC APPLIED ENTOMOLOGY|KOREAN SOCIETY OF APPLIED ENTOMOLOGY
KOREAN SOC MECHANICAL ENGINEERS|KOREAN SOCIETY OF MECHANICAL ENGINEERS
KOREAN SOC PARASITOLOGY, SEOUL NATL UNIV COLL MEDI|KOREAN JOURNAL OF PARASITOLOGY
Korean Society Phycology|THE KOREAN SOCIETY OF PHYCOLOGY
Max Planck Institut Gravitational Physic|MAX PLANCK INSTITUT  GRAVITATIONAL  PHYSICS-ALBERT EINSTEIN INSTITUTE
MDPI AG|MULTIDISCIPLINARY DIGITAL PUBLISHING INSTITUTE AG
MEDKNOW PUBLICATIONS \& MEDIA PVT LTD|MEDKNOW PUBLICATIONS AND MEDIA PVT LTD
MICHIGAN STATE UNIV PRESS|MICHIGAN STATE UNIVERSITY PRESS
MICROBIOLOGICAL SOCIETY KOREA|MICROBIOLOGICAL SOCIETY OF KOREA
MINN LAW REVIEW FOUND|MINNESOTA LAW REVIEW FOUNDATION
MODERN HUMANITIES RES ASSN|MODERN HUMANITIES RESEARCH ASSOCIATION
MODERN LANGUAGE ASSOC AMER|MODERN LANGUAGE ASSOCIATION (MLA)
MUSEUM \& INST ZOOLOGY PAS-POLISH ACAD SCIENCES|MUSEUM AND INSTITUTE OF ZOOLOGY OF THE POLISH ACADEMY OF SCIENCES
NATL ACAD SCIENCES|NATIONAL ACADEMY OF SCIENCES
NATIONAL ACADEMY OF SCIENCES|NATIONAL ACADEMY OF SCIENCES
NATL ASSOC BIOLOGY TEACHERS, INC|NATIONAL ASSOCIATION OF BIOLOGY TEACHERS, INC
NATL ASSOC CORROSION ENG|NATIONAL ASSOCIATION OF CORROSION ENGINEERS
NATL INST OCCUPATIONAL SAFETY \& HEALTH, JAPAN|NATIONAL INSTITUTE OF OCCUPATIONAL SAFETY AND HEALTH, JAPAN
NATL RECREATION PARK ASSOC|NATIONAL RECREATION AND PARK ASSOCIATION
NATL TAX ASSOC|NATIONAL TAX ASSOCIATION
NATL ASSOC SCHOOL PSYCHOLOGISTS|NATIONAL ASSOCIATION OF SCHOOL PSYCHOLOGISTS
NEOTROPICAL ORNITHOLOGICAL SOC, USGS PATUXENT WILDLIFE RESEARCH CTR|NEOTROPICAL ORNITHOLOGICAL SOCIETY
NEW YORK UNIV|NEW YORK UNIVERSITY
NORTHEAST FORESTRY UNIV|NORTHEAST FORESTRY UNIVERSITY 
OFFICE SPECTROSCOPY \& SPECTRAL ANALYSIS|SPECTROSCOPY AND SPECTRAL ANALYSIS
OPTICAL SOC AMER|OPTICAL SOCIETY OF AMERICA
ORGANIZATION AMER HISTORIANS|ORGANIZATION OF AMERICAN HISTORIANS
OXFORD UNIV PRESS INC|OXFORD UNIVERSITY PRESS INC
PIONEER BIOSCIENCE PUBL CO|PIONEER BIOSCIENCE PUBLISHING COMPANY
PITTSBURG STATE UNIV|PITTSBURG STATE UNIVERSITY
POLISH ACAD SCIENCES INST MATHEMATICS|INSTITUTE OF MATHEMATICS POLISH ACADEMY OF SCIENCES
POLISH ACAD SCIENCES INST PHYSICS|POLISH ACADEMY OF SCIENCES INSTITUTE OF PHYSICS
PRECAST/PRESTRESSED CONCRETE INST|PRECAST/PRESTRESSED CONCRETE INSTITUTE (PCI)
PUBLIC LIBRARY SCIENCE|PUBLIC LIBRARY OF SCIENCE
QUINTESSENCE PUBLISHING COMPANY INC|QUINTESSENCE PUBLISHING CO INC
RADIOLOGICAL SOC NORTH AMERICA|RADIOLOGICAL SOCIETY OF NORTH AMERICA
Reed Business Information Ltd|REED BUSINESS INFORMATION LTD
REVISTA BIOTA NEOTROPICA|BIOTA NEOTROPICA
REVISTA BRASILEIRA DE ZOOTECNIA-BRAZILIAN JOURNAL OF ANIMAL SCIENCE|BRAZILIAN JOURNAL OF ANIMAL SCIENCE
REVISTA DE NEUROLOGIA|REVISTA DE NEUROLOGIA
ROSENSTIEL SCH MAR ATMOS SCI|THE ROSENSTIEL SCHOOL OF MARINE AND ATMOSPHERIC SCIENCE
ROYAL SOC CHEMISTRY|ROYAL SOCIETY OF CHEMISTRY
SAN DIEGO STATE UNIV|SAN DIEGO STATE UNIVERSITY
SAUDI MED J|SAUDI MEDICAL JOURNAL
SAUDI THORACIC SOC|SAUDI THORACIC SOCIETY
SCIENCE \& TECHNOLOGY NETWORK INC|SCIENCE AND TECHNOLOGY NETWORK INC
SCIENTIFIC TECHNICAL RESEARCH COUNCIL TURKEY-TUBITAK|THE SCIENTIFIC AND TECHNOLOGICAL RESEARCH COUNCIL OF TURKEY
SCI PRINTERS AND PUBL INC|SCIENCE PRINTERS AND PUBLISHERS INC
SOC ADVANCEMENT BEHAVIOR ANALYSIS|SOCIETY FOR THE ADVANCEMENT OF BEHAVIOR ANALYSIS
SOC AMER FORESTERS|SOCIETY OF AMERICAN FORESTERS
SOC APPLIED SPECTROSCOPY|SOCIETY FOR APPLIED SPECTROSCOPY
SOC BIOLGIA CHILE|THE SOCIETY OF BIOLOGY OF CHILE
SOC BRASIL ENGENHARIA AGRICOLA|SOCIETY OF BRASIL ENGENHARIA AGRICOLA
SOC BRASIL GENETICA|SOCIETY OF BRASIL GENETICA
SOC BRASILEIRA DE CIENCIA DO SOLO|BRAZILIAN SOIL SCIENCE SOCIETY
SOC BRASILEIRA FITOPATOLOGIA|SOCIEDADE BRASILEIRA DE FITOPATOLOGIA
SOC BRASILEIRA ICTIOLOGIA|BRAZILIAN SOCIETY OF ICHTHYOLOGY
SOC BRASILEIRA ZOOLOGIA, UNIV FEDERAL PARANA|SOCIETY BRASILEIRA ZOOLOGIA, UNIVERSITY FEDERAL PARANA
SOC CHILENA CIENCIA SUELO|SOCIETY OF CHILENA CIENCIA SUELO
SOC GENERAL MICROBIOLOGY|SOCIETY FOR GENERAL MICROBIOLOGY
SOC NEMATOLOGISTS|SOCIETY OF NEMATOLOGISTS
SOC NEUROSCIENCE|SOCIETY OF NEUROSCIENCE
SOC NUCLEAR MEDICINE INC|SOCIETY OF NUCLEAR MEDICINE INC
SOC QUIMICA MEXICO|JOURNAL OF THE MEXICAN CHEMICAL SOCIETY
SOC STUDY AMPHIBIANS REPTILES|SOCIETY FOR THE STUDY OF AMPHIBIANS AND REPTILES
SOC STUDY REPRODUCTION|SOCIETY FOR THE STUDY OF REPRODUCTION
SOC TEACHERS FAMILY MEDICINE|SOCIETY OF TEACHERS OF FAMILY MEDICINE
SOC TEACHERS FAMILY MEDICINE|SOCIETY OF TEACHERS OF FAMILY MEIDCINE
SOC VERTEBRATE PALEONTOLOGY|SOCIETY OF VERTEBRATE PALEONTOLOGY
SOIL SCI SOC AMER|SOIL SCIENCE SOCIETY OF AMERICA
SOUTHERN APPALACHIAN BOTANICAL SOC, NEWBERRY COLL|SOUTHERN APPALACHIAN BOTANICAL SOCIETY
SPIE-SOC PHOTO-OPTICAL INSTRUMENTATION ENGINEERS|THE SOCIETY OF PHOTO-OPTICAL INSTRUMENTATION ENGINEERS
SPIE-SOC PHOTOPTICAL INSTRUMENTATION ENGINEERS|SOCIETY OF PHOTOPTICAL INSTRUMENTATION ENGINEERS
TEACHERS COLL OF COLUMBIA UNIV|TEACHERS COLLEGE OF COLUMBIA UNIVERSITY
TOHOKU UNIV MEDICAL PRESS|TOHOKU UNIVERSITY MEDICAL PRESS
TROPICAL CONSERVATION SCIENCE|TROPICAL CONSERVATION SCIENCE
UNIV ANTIOQUIA, FAC CIENCIAS AGRARIAS|UNIVERSITY OF ANTIOQUIA, FAC CIENCIAS AGRARIAS
UNIV CALIF|UNIVERSITY OF CALIFORNIA
UNIVERSITY OF CALIFORNIAORNIA PRESS |UNIVERSITY OF CALIFORNIA
UNIVERSITY CORDOBA|UNIVERSITY OF CORDOBA
University Virginia|UNIVERSITY OF VIRGINIA
UNIV CHICAGO PRESS|UNIVERSITY OF CHICAGO PRESS
UNIV FEDERAL UBERLANDIA|UNIVERSITY OF FEDERAL UBERLANDIA
UNIV HAWAII PRESS|UNIVERSITY OF HAWAII PRESS
UNIV ILLINOIS PRESS|UNIVERSITY OF ILLINOIS PRESS
UNIV ILLINOIS, URBANA-CHAMPAIGN|UNIVERSITY OF ILLINOIS, URBANA-CHAMPAIGN
UNIV IOWA, COLL LAW|UNIVERSITY OF IOWA, COLLEGE LAW
UNIV KRAGUJEVAC, FAC SCIENCE|FACULTY OF MEDICAL SCIENCES UNIVERSITY OF KRAGUJEVAC
UNIV LAVAL|UNIVERSITY LAVAL
UNIV MARYLAND-CTR RENAISSANCE \& BAROQUE STUD|CENTER FOR RENAISSANCE AND BAROQUE STUDIES
UNIV MINNESOTA PRESS|UNIVERSITY OF MINNESOTA PRESS
UNIV NAPLES FEDERICO II|UNIVERSITY OF NAPLES FEDERICO II
UNIV NEW MEXICO|UNIVERSITY OF NEW MEXICO
UNIV NORTH CAROLINA |UNIVERSITY OF NORTH CAROLINA
UNIV PENNSYLVANIA PRESS|UNIVERSITY OF PENNSYLVANIA PRESS
UNIV SAO PAOLO|UNIVERSITY OF SAO PAOLO
UNIV TEHRAN|UNIVERSITY OF TEHRAN
UNIV WISCONSIN LAW SCHOOL|UNIVERSITY OF WISCONSIN LAW SCHOOL
UROL \& NEPHROL RES CTR-UNRC|UROLOGY AND NEPHROLOGY RESEARCH CENTER
WEED SCI SOC AMER|WEED SCIENCE SOCIETY OF AMERICA
WILDLIFE DISEASE ASSOC, INC|WILDLIFE DISEASE ASSOCIATION, INC
WORLD SCIENTIFIC PUBL COMPANY PTE LTD|WORLD SCIENTIFIC PUBLISHING CO. PTE. LTD.
UNIV WISCONSIN PRESS |UNIVERSITY OF WISCONSIN PRESS
Classical Association Canada|The Classical Association of Canada
Elife Sciences Publications Ltd|eLife Sciences Publications, Ltd
{{|{
}}|}
``|'
{''}|&quot;
,}|}
\&|and
&|and
Web of Science|Web-of-Science
Meeting Abstract|Meeting-Abstract
\{[}\}| 
